{
  "Age": 50,
  "Height": 160,
  "Weight": 60,
  "BMI": 23.4,
  "CA199": 10,
  "CA125": 15,
  "AFP": 3,
  "CEA": 2,
  "HCG-B": 1,
  "LH": 5,
  "FSH": 6,
  "PRL": 12,
  "E2": 30,
  "HER2(s)": 3,
  "Weight Standard (4)": 1,
  "Affected Breast": 1,
  "PT Location": 2,
  "ER status": 0,
  "PR status": 0,
  "cT": 2,
  "cN": 1,
  "Stage": 2,
  "Size": 30,
  "Histological Grade": 2,
  "ER": 0,
  "HR": 0,
  "HER2": 3,
  "Ki-67": 40,
  "AR": 0,
  "CD8": 0,
  "FOXC1": 0,
  "mr_roi_available": 0,
  "pet_roi_available": 0,
  "roi_ambiguous_series": 1
}
